{
  "$schema": "http://json-schema.org/draft-07/schema#",
  "$id": "commitment.schema.json",
  "title": "Commitment",
  "description": "An obligation the owner made, to themselves or to another person. The outbound half of the owner's first priority — zero broken promises; the inbound mirror is waiting-on. Child tasks are no longer embedded here: tasks are first-class records in _data/tasks/ that point back with commitment_id, because per ADR-008 an entity that can exist without a parent cannot be stored inside one.",
  "type": "object",
  "required": ["id", "description", "status", "priority", "created"],
  "additionalProperties": false,
  "properties": {
    "id": { "type": "string", "pattern": "^c-[0-9]+" },
    "project_id": {
      "type": ["string", "null"],
      "default": null,
      "description": "Project this commitment belongs to, or null when it stands alone. Parentless commitments are visible through the unfiled view."
    },
    "description": { "type": "string" },
    "promised_to": {
      "type": ["string", "null"],
      "default": null,
      "description": "Person ID if the identity is confirmed, otherwise the name as written; null for a self-commitment. Protected: an agent never invents who a promise was made to."
    },
    "due_date": {
      "type": ["string", "null"],
      "format": "date",
      "description": "Protected: an agent never invents a deadline."
    },
    "status": {
      "type": "string",
      "enum": ["open", "in_progress", "complete", "blocked", "cancelled"]
    },
    "priority": {
      "type": "string",
      "enum": ["high", "medium", "low"]
    },
    "created": { "type": "string", "format": "date" },
    "completed": {
      "type": ["string", "null"],
      "format": "date",
      "description": "Protected: an agent never invents completion of anything."
    },
    "tags": { "type": "array", "items": { "type": "string" }, "default": [] },
    "notes": { "type": "string", "default": "" },
    "capture": { "$ref": "evidence.schema.json#/definitions/capture_source" }
  }
}
